status_id,status_message,link_name,status_type,status_link,permalink_url,status_published,num_reactions,num_comments,num_shares,num_likes,num_loves,num_wows,num_hahas,num_sads,num_angrys
669417179838095_1112043672242108,"When life throws you L's, you turn 'em into W's. But losing 10 years of your life to an early death caused by cigs is an L you can't flip. Keep it fresh, keep winning.",Timeline Photos,photo,https://www.facebook.com/FreshEmpire/photos/a.725948810851598.1073741828.669417179838095/1112043672242108/?type=3,https://www.facebook.com/FreshEmpire/posts/1112043672242108:0,2016-11-16 14:30:01,508,0,3,479,25,0,4,0,0
669417179838095_1111250952321380,"Ivy Rivera is definitely on her grind. Watch her kick facts about coming up as a radio personality, event host, and brand ambassador. Watch the full interview on the site: http://bit.ly/comeup5",Ivy Rivera: The Come Up,video,https://www.facebook.com/FreshEmpire/videos/1111250952321380/,https://www.facebook.com/FreshEmpire/videos/1111250952321380/,2016-11-15 19:00:22,1051,9,60,953,78,13,4,2,1
669417179838095_1110403925739416,"Settin' new waves is about originality and chasin' life tobacco-free. 🌊  🌊  🌊 
Don't lose 10 years of your life to an early death caused by cigs, keep it fresh.",Timeline Photos,photo,https://www.facebook.com/FreshEmpire/photos/a.725948810851598.1073741828.669417179838095/1110403925739416/?type=3,https://www.facebook.com/FreshEmpire/posts/1110403925739416:0,2016-11-14 20:12:01,13,0,0,11,2,0,0,0,0
669417179838095_1107826965997112,"First step is believing in yourself. LIKE if you are without a doubt, destined for greatness. 💯 💯 💯",Timeline Photos,photo,https://www.facebook.com/FreshEmpire/photos/a.725948810851598.1073741828.669417179838095/1107826965997112/?type=3,https://www.facebook.com/FreshEmpire/posts/1107826965997112:0,2016-11-12 14:30:01,19,0,2,17,2,0,0,0,0
669417179838095_1107049389408203,Each cigarette you smoke can reduce your overall lifespan by 11 mins. That's time you can't get back. What would you rather do with that time instead?,Timeline Photos,photo,https://www.facebook.com/FreshEmpire/photos/a.725948810851598.1073741828.669417179838095/1107049389408203/?type=3,https://www.facebook.com/FreshEmpire/posts/1107049389408203:0,2016-11-11 18:52:01,1201,10,14,1125,62,8,2,3,1
669417179838095_1105797392866736,"Staying original has helped this sister duo create a unique sound that's all their own. Watch as our favorite soulful singers, VanJess, open up to Fresh Empire about why they stay chasin' life. http://bit.ly/comeup3",Timeline Photos,photo,https://www.facebook.com/FreshEmpire/photos/a.725948810851598.1073741828.669417179838095/1105797392866736/?type=3,https://www.facebook.com/FreshEmpire/posts/1105797392866736:0,2016-11-10 16:45:01,15,1,0,13,2,0,0,0,0
669417179838095_1105628482883627,"Who fell through and kicked it with Fresh Empire the weekend of 10.31-11.06? TAG yourself or your squad, if you were at Trap or Treat in Dallas, Lil Uzi Vert Concert in Chicago, Tory Lanez I Told You Tour in Albuquerque, World of Dance in San Diego, The Real Show in Inglewood, West Coast Dance Off in Las Vegas, The Home Field Major Experience in Baltimore, or ComplexCon in Long Beach.",Fresh Empire,photo,https://www.facebook.com/FreshEmpire/photos/a.1105381702908305.1073741934.669417179838095/1105382179574924/?type=3,https://www.facebook.com/FreshEmpire/posts/1105628482883627,2016-11-10 14:49:56,14,0,0,11,3,0,0,0,0
669417179838095_1104653066314502,Big K.R.I.T. kicked it with Fresh Empire to talk about why it's important to keep his health on point as he grinds day in and day out. Watch and share.,Big K.R.I.T. | Defying the Odds Pt.1,video,https://www.facebook.com/FreshEmpire/videos/1104653066314502/,https://www.facebook.com/FreshEmpire/videos/1104653066314502/,2016-11-09 20:13:10,630,9,24,593,30,1,4,1,1
669417179838095_1103216596458149,"When you stay looking fresh and tobacco-free, you stay camera ready. 📷  📷  📷  How else do you keep your looks on point??",Timeline Photos,photo,https://www.facebook.com/FreshEmpire/photos/a.725948810851598.1073741828.669417179838095/1103216596458149/?type=3,https://www.facebook.com/FreshEmpire/posts/1103216596458149:0,2016-11-08 15:36:01,2828,3,8,2714,93,14,5,1,1
669417179838095_1102036773242798,"When you're out there gettin' yours, you gotta live tobacco-free because smoking cigs can cut your life short by 10 years.",Timeline Photos,photo,https://www.facebook.com/FreshEmpire/photos/a.725948810851598.1073741828.669417179838095/1102036773242798/?type=3,https://www.facebook.com/FreshEmpire/posts/1102036773242798:0,2016-11-07 16:10:02,15,0,1,14,1,0,0,0,0
669417179838095_1100302966749512,What's the newest dance about to blow up? Let us know in the comments.,Timeline Photos,photo,https://www.facebook.com/FreshEmpire/photos/a.725948810851598.1073741828.669417179838095/1100302966749512/?type=3,https://www.facebook.com/FreshEmpire/posts/1100302966749512:0,2016-11-06 12:37:01,20,0,0,18,0,1,1,0,0
669417179838095_1097582413688234,"VanJess popped up on the YouTube scene by giving hip-hop songs a soulful twist. Check their come up, and watch the full interview on the site:: http://bit.ly/comeup3.",VanJess: The Come Up,video,https://www.facebook.com/FreshEmpire/videos/1097582413688234/,https://www.facebook.com/FreshEmpire/videos/1097582413688234/,2016-11-04 10:00:22,2020,13,185,1747,254,15,3,0,1
669417179838095_1096605913785884,What artist or producer has surprised you the most this year? GO! 🎤 🎹 🎤,Timeline Photos,photo,https://www.facebook.com/FreshEmpire/photos/a.725948810851598.1073741828.669417179838095/1096605913785884/?type=3,https://www.facebook.com/FreshEmpire/posts/1096605913785884:0,2016-11-03 18:15:01,11,2,0,11,0,0,0,0,0
669417179838095_1095039393942536,You've seen this 14-year-old dancer all over YouTube and now he's taking over your 📺. Watch as we catch up with Kida The Great on how his journey got him to where he is today. http://bit.ly/comeup2,Timeline Photos,photo,https://www.facebook.com/FreshEmpire/photos/a.725948810851598.1073741828.669417179838095/1095039393942536/?type=3,https://www.facebook.com/FreshEmpire/posts/1095039393942536:0,2016-11-02 14:45:02,35,2,3,33,2,0,0,0,0
669417179838095_1093237640789378,Being tobacco-free gives you a full battery every day to go out and chase life.🔋🔋🔋. Who's charged up?,Timeline Photos,photo,https://www.facebook.com/FreshEmpire/photos/a.725948810851598.1073741828.669417179838095/1093237640789378/?type=3,https://www.facebook.com/FreshEmpire/posts/1093237640789378:0,2016-11-01 09:00:02,1504,13,21,1408,86,8,2,0,0
669417179838095_1092653477514461,Lenny S got the 🔑 🔑 🔑 . He's a mogul in the business and he's lookin' to put his cosign behind who's hot. Make sure you enter by this Wednesday. http://bit.ly/Cosign1,Timeline Photos,photo,https://www.facebook.com/FreshEmpire/photos/a.725948810851598.1073741828.669417179838095/1092653477514461/?type=3,https://www.facebook.com/FreshEmpire/posts/1092653477514461:0,2016-10-31 18:45:01,133,1,1,128,3,1,1,0,0
669417179838095_1091334514313024,Confidence is 🔑 🔑 🔑 to success. What else keeps you on track toward your goals?,Timeline Photos,photo,https://www.facebook.com/FreshEmpire/photos/a.725948810851598.1073741828.669417179838095/1091334514313024/?type=3,https://www.facebook.com/FreshEmpire/posts/1091334514313024:0,2016-10-30 17:45:01,1741,13,19,1682,45,2,10,0,2
669417179838095_1089086454537830,"Submit a video or track of yourself rapping, singing, or beatboxing for your chance to get a studio experience with Big K.R.I.T. and link ⬆ with mogul Lenny S of Roc Nation.  http://bit.ly/Cosign1",Contest Promo 30 Caption-HD.mp4,video,https://www.facebook.com/FreshEmpire/videos/1089086454537830/,https://www.facebook.com/FreshEmpire/videos/1089086454537830/,2016-10-28 20:25:23,34,7,6,30,4,0,0,0,0
669417179838095_1087585748021234,Dap to everyone out there on that tobacco-free grind. Keep it fresh. 👊🏽 👊🏽 👊🏽,Timeline Photos,photo,https://www.facebook.com/FreshEmpire/photos/a.725948810851598.1073741828.669417179838095/1087585748021234/?type=3,https://www.facebook.com/FreshEmpire/posts/1087585748021234:0,2016-10-27 15:15:02,497,1,7,477,18,0,2,0,0
669417179838095_1086514798128329,"Who fell through and kicked it with Fresh Empire the weekend of 10.17-10.23? TAG yourself or your squad, if you were at the YG Live in Concert in Boston, the ScremmLife 2 Tour in Boston, Baltimore and Norfolk, Too Much Sauce in Baltimore, the Hip Hop Summit in Sacramento, So Fresh Saturday: NJ Edition, World of Dance in Houston, 2Turnt Saturday in Chicago, or So Turnt Saturday: Black & Glow Edition in Charlotte.",Weekend Wrap-Up 10.17-10.23,photo,https://www.facebook.com/FreshEmpire/photos/a.1086514651461677.1073741932.669417179838095/1086514798128329/?type=3,https://www.facebook.com/FreshEmpire/posts/1086514798128329,2016-10-26 19:13:58,1022,12,9,971,38,1,11,0,1
669417179838095_1086082914838184,See how Kida The Great turned dancing in his living room into a professional career by the age of 14. Check the full vid on our site: http://bit.ly/comeup2.,Kida 30 Captions-HD.mp4,video,https://www.facebook.com/FreshEmpire/videos/1086082914838184/,https://www.facebook.com/FreshEmpire/videos/1086082914838184/,2016-10-26 09:30:23,1816,33,186,1504,266,34,9,1,2
669417179838095_1084883664958109,"Fresh mentality, all day everyday. 💪🏽  💪🏽  💪🏽  Why do you keep it fresh and tobacco-free?",Timeline Photos,photo,https://www.facebook.com/FreshEmpire/photos/a.725948810851598.1073741828.669417179838095/1084883664958109/?type=3,https://www.facebook.com/FreshEmpire/posts/1084883664958109:0,2016-10-25 10:00:01,8889,30,53,8367,393,111,12,0,6
669417179838095_1084123988367410,Smoking cigarettes goes against the grind by reducing your life by 10 years. How do you stay chasin' life instead? 💪🏽 💪🏽 💪🏽,Timeline Photos,photo,https://www.facebook.com/FreshEmpire/photos/a.725948810851598.1073741828.669417179838095/1084123988367410/?type=3,https://www.facebook.com/FreshEmpire/posts/1084123988367410:0,2016-10-24 19:20:01,21,0,1,20,1,0,0,0,0
669417179838095_1082684741844668,One pair of kicks for the rest of your life. Let us know your pick in the comments.,Timeline Photos,photo,https://www.facebook.com/FreshEmpire/photos/a.725948810851598.1073741828.669417179838095/1082684741844668/?type=3,https://www.facebook.com/FreshEmpire/posts/1082684741844668:0,2016-10-23 13:30:01,1792,41,15,1718,59,12,2,0,1
669417179838095_1081552511957891,TAG the Day 1s in your squad who are chasin' life tobacco-free. 👊🏽 👊🏽 👊🏽,Timeline Photos,photo,https://www.facebook.com/FreshEmpire/photos/a.725948810851598.1073741828.669417179838095/1081552511957891/?type=3,https://www.facebook.com/FreshEmpire/posts/1081552511957891:0,2016-10-22 17:15:01,1858,5,15,1746,94,13,3,2,0
669417179838095_1080093382103804,"You don't strive to be original just to let tobacco mess with your fresh. 👌🏽 👌🏽 👌🏽
LIKE if you're too unique to let cigs make you a statistic.",Timeline Photos,photo,https://www.facebook.com/FreshEmpire/photos/a.725948810851598.1073741828.669417179838095/1080093382103804/?type=3,https://www.facebook.com/FreshEmpire/posts/1080093382103804:0,2016-10-21 11:00:03,1669,4,11,1617,29,14,9,0,0
669417179838095_1079088852204257,,Fresh Empire,photo,https://www.facebook.com/FreshEmpire/photos/a.1078914152221727.1073741931.669417179838095/1078914308888378/?type=3,https://www.facebook.com/FreshEmpire/posts/1079088852204257,2016-10-20 13:35:14,1536,10,0,1482,39,2,3,2,8
669417179838095_1078888698890939,Big K.R.I.T. had a vision that took him from the bottom to the top. SHARE this post if you rock with K.R.I.T. cause he's living tobacco-free. 🎵 🎵 🎵,Timeline Photos,photo,https://www.facebook.com/FreshEmpire/photos/a.725948810851598.1073741828.669417179838095/1078888698890939/?type=3,https://www.facebook.com/FreshEmpire/posts/1078888698890939:0,2016-10-20 09:00:02,453,0,8,434,16,1,2,0,0
669417179838095_1078059805640495,"Advice from record label execs is hard to come across, so take notes while watching Lenny S drop some major keys. 🔑 🔑 🔑",Battle For The Cosign- Lenny S,video,https://www.facebook.com/FreshEmpire/videos/1078059805640495/,https://www.facebook.com/FreshEmpire/videos/1078059805640495/,2016-10-19 13:00:27,30,3,2,29,1,0,0,0,0
669417179838095_1077312445715231,LIKE if you live tobacco-free because you won't let an addiction  stop your wave. 🌊 🌊 🌊,Timeline Photos,photo,https://www.facebook.com/FreshEmpire/photos/a.725948810851598.1073741828.669417179838095/1077312445715231/?type=3,https://www.facebook.com/FreshEmpire/posts/1077312445715231:0,2016-10-18 18:15:01,1562,4,13,1477,76,7,2,0,0
669417179838095_1075693842543758,Fresh Empire linked up with Big K.R.I.T. to give advice to artists on the come-up in the music industry. Watch and share.,Big K.R.I.T. | Defying the Odds Pt.2,video,https://www.facebook.com/FreshEmpire/videos/1075693842543758/,https://www.facebook.com/FreshEmpire/videos/1075693842543758/,2016-10-17 14:31:05,935,21,70,872,45,7,10,0,1
669417179838095_1073939586052517,"From the city, to the state, to the country, to the world.📍📍📍 Where would you love to perform? 🌎",Timeline Photos,photo,https://www.facebook.com/FreshEmpire/photos/a.725948810851598.1073741828.669417179838095/1073939586052517/?type=3,https://www.facebook.com/FreshEmpire/posts/1073939586052517:0,2016-10-15 19:20:01,2315,12,14,2210,57,13,33,1,1
669417179838095_1072674516179024,"SHARE the tobacco-free hustle:

Step 1 - Chase life.
Step 2 - Get on.
Step 3 - Help others blow up.",Timeline Photos,photo,https://www.facebook.com/FreshEmpire/photos/a.725948810851598.1073741828.669417179838095/1072674516179024/?type=3,https://www.facebook.com/FreshEmpire/posts/1072674516179024:0,2016-10-14 12:45:01,487,0,13,469,13,1,1,1,2
669417179838095_1071554539624355,"Roc Nation executive, Lenny S, is listening to music submitted in our contest. Watch the vid and submit yours today. 👉🏽 👉🏽 👉🏽 http://bit.ly/Cosign1",BFTC Lenny Promo 30 Final,video,https://www.facebook.com/FreshEmpire/videos/1071554539624355/,https://www.facebook.com/FreshEmpire/videos/1071554539624355/,2016-10-13 14:15:46,20,0,4,20,0,0,0,0,0
669417179838095_1071464982966644,,Fresh Empire,photo,https://www.facebook.com/FreshEmpire/photos/a.1071341596312316.1073741930.669417179838095/1071341649645644/?type=3,https://www.facebook.com/FreshEmpire/posts/1071464982966644,2016-10-13 12:24:25,601,0,0,585,12,0,4,0,0
669417179838095_1070718339707975,TAG your friends that you think would fit in with the tobacco-free crew at Fresh Empire. 💯 🙋🏽 🙋🏽 💯,Timeline Photos,photo,https://www.facebook.com/FreshEmpire/photos/a.725948810851598.1073741828.669417179838095/1070718339707975/?type=3,https://www.facebook.com/FreshEmpire/posts/1070718339707975:0,2016-10-12 18:45:02,4574,33,27,4394,161,3,15,0,1
669417179838095_1069617249818084,"S/O to our Fresh Moves contest winner who won a trip to LA to meet The Kinjaz! If you want your chance at some swaggy prizes too, make sure to hop into our Battle for the Cosign contest by Nov. 2nd. http://bit.ly/Cosign1",Timeline Photos,photo,https://www.facebook.com/FreshEmpire/photos/a.725948810851598.1073741828.669417179838095/1069617249818084/?type=3,https://www.facebook.com/FreshEmpire/posts/1069617249818084:0,2016-10-11 15:32:02,10,0,0,10,0,0,0,0,0
669417179838095_1069372349842574,Chasing life over death means living tobacco-free.  'Cause each cig smoked reduces your overall lifespan by 11 mins.,Timeline Photos,photo,https://www.facebook.com/FreshEmpire/photos/a.725948810851598.1073741828.669417179838095/1069372349842574/?type=3,https://www.facebook.com/FreshEmpire/posts/1069372349842574:0,2016-10-11 10:15:01,818,5,15,783,29,5,1,0,0
669417179838095_1068732923239850,"The youngest in charge, WondaGurl, is droppin' serious gems about being successful in the music biz.",Battle for the Cosign |  Wondagurl,video,https://www.facebook.com/FreshEmpire/videos/1068732923239850/,https://www.facebook.com/FreshEmpire/videos/1068732923239850/,2016-10-10 15:15:26,866,16,35,801,40,20,5,0,0
669417179838095_1068492003263942,"Who wants it the most? Wondagurl is looking for the next rapper, singer, or beat boxer. Make sure you enter your submission in the Battle for the Cosign here: http://bit.ly/Cosign1",Timeline Photos,photo,https://www.facebook.com/FreshEmpire/photos/a.725948810851598.1073741828.669417179838095/1068492003263942/?type=3,https://www.facebook.com/FreshEmpire/posts/1068492003263942:0,2016-10-10 09:00:01,97,0,4,96,1,0,0,0,0
669417179838095_1067685136677962,"Break boundaries, keep pushin', and never let cigs trap you in a box. How do you chase life? 💯  💯 💯",Timeline Photos,photo,https://www.facebook.com/FreshEmpire/photos/a.725948810851598.1073741828.669417179838095/1067685136677962/?type=3,https://www.facebook.com/FreshEmpire/posts/1067685136677962:0,2016-10-09 08:30:01,777,4,6,744,29,0,4,0,0
669417179838095_1067093036737172,Where the real go-getters at? TAG someone that grinds as hard as you. 👊🏽 👊🏽 👊🏽,Timeline Photos,photo,https://www.facebook.com/FreshEmpire/photos/a.725948810851598.1073741828.669417179838095/1067093036737172/?type=3,https://www.facebook.com/FreshEmpire/posts/1067093036737172:0,2016-10-08 14:30:01,5570,16,28,5323,184,49,11,1,2
669417179838095_1066252920154517,"Straight up, here's your chance to kick it with Big K.R.I.T. in the studio, chop it up with music mogul Lenny S, and more. Battle For The Cosign is the move! http://bit.ly/Cosign1",Battle For The Cosign,video,https://www.facebook.com/FreshEmpire/videos/1066252920154517/,https://www.facebook.com/FreshEmpire/videos/1066252920154517/,2016-10-07 17:25:33,31,2,3,30,1,0,0,0,0
669417179838095_1066042193508923,"Who fell through and kicked it with Fresh Empire the weekend of 9.28 - 10.2? TAG yourself or your squad, if you were at the Summer Sixteen Tour: Drake & Future on 9.28 and 9.29 in Inglewood, CA, Fresh for the Fall Tailgate in Greensboro, NC, Chance the Rapper concert in Boston, Raleigh Take Over with Miss Mulatto, Post Malone: Hollywood Dreams Tour in Norfolk, VA, So Turnt Saturday in Los Angeles, Sweet Auburn Music Fest in Atlanta, State Fair Classic in Dallas, The Solexchange in Brooklyn, The Sneaker Exit in Atlanta, Squad Goals in Charlotte, and Trillmania in Miami.",Fresh Empire,photo,https://www.facebook.com/FreshEmpire/photos/a.1065993386847137.1073741929.669417179838095/1065993566847119/?type=3,https://www.facebook.com/FreshEmpire/posts/1066042193508923,2016-10-07 11:47:08,647,0,0,629,12,4,1,0,1
669417179838095_1065504993562643,"Smoking is like hustlin' backwards, cause cigs can cut your life short by 10 years. Forget death, chase life.",Timeline Photos,photo,https://www.facebook.com/FreshEmpire/photos/a.725948810851598.1073741828.669417179838095/1065504993562643/?type=3,https://www.facebook.com/FreshEmpire/posts/1065504993562643:0,2016-10-06 17:30:01,629,3,13,607,21,0,1,0,0
669417179838095_1063675263745616,"By keeping it fresh and tobacco-free, you stay callin' the shots in your life. 💪🏽 💪🏽 💪🏽 Are you in control?",Timeline Photos,photo,https://www.facebook.com/FreshEmpire/photos/a.725948810851598.1073741828.669417179838095/1063675263745616/?type=3,https://www.facebook.com/FreshEmpire/posts/1063675263745616:0,2016-10-04 13:45:01,4031,16,21,3800,214,15,2,0,0
669417179838095_1063030710476738,Big K.R.I.T. kicked it with Fresh Empire to talk about why it's important to keep his health on point as he grinds day in and day out. Watch and share.,Big K.R.I.T. | Defying the Odds Pt.1,video,https://www.facebook.com/FreshEmpire/videos/1063030710476738/,https://www.facebook.com/FreshEmpire/videos/1063030710476738/,2016-10-03 18:16:14,765,27,36,726,26,2,10,1,0
669417179838095_1061985373914605,When they're braggin' about yesterday's accomplishments but you're already lookin' to the future. 🔮 🔮 🔮 What does it hold?,Timeline Photos,photo,https://www.facebook.com/FreshEmpire/photos/a.725948810851598.1073741828.669417179838095/1061985373914605/?type=3,https://www.facebook.com/FreshEmpire/posts/1061985373914605:0,2016-10-02 14:30:02,661,0,3,641,18,0,0,0,2
669417179838095_1060991467347329,"Don't take an L by losing 10 years of your life to smoking cigarettes. Chase life, not death.",Timeline Photos,photo,https://www.facebook.com/FreshEmpire/photos/a.725948810851598.1073741828.669417179838095/1060991467347329/?type=3,https://www.facebook.com/FreshEmpire/posts/1060991467347329:0,2016-10-01 11:00:02,881,4,26,843,29,5,2,0,2
669417179838095_1060847060695103,,Fresh Empire's cover photo,photo,https://www.facebook.com/FreshEmpire/photos/a.711977672248712.1073741827.669417179838095/1060847060695103/?type=3,https://www.facebook.com/FreshEmpire/posts/1060847100695099,2016-10-01 07:42:04,11,0,2,10,0,1,0,0,0
669417179838095_1060177330762076,"When you're about the hustle, cigs can't be a part of it. Are you makin' moves tobacco-free? 🙌  🙌",Timeline Photos,photo,https://www.facebook.com/FreshEmpire/photos/a.725948810851598.1073741828.669417179838095/1060177330762076/?type=3,https://www.facebook.com/FreshEmpire/posts/1060177330762076:0,2016-09-30 12:30:02,2397,10,19,2257,124,13,3,0,0
669417179838095_1059638897482586,"Who fell through and kicked it with Fresh Empire the weekend of 9.19 - 9.25? TAG yourself or your squad, if you were at The Private Club Tour in Dallas, Final Friday Featuring Sage the Gemini and Heated Sole Summit 7 in Phoenix, Trap City in Lawrence, So Fresh Friday - The Columbia Takeover in Columbia, #HOF Day Party 2016 in West Sacramento, Bring It On Part 2 in Tampa, World of Dance Tour in San Francisco, Remix Saturdays in Henderson, So Fresh Saturday in VA Beach, So Fresh Saturday: Dance Therapy Edition in Greensboro, Solefest in Charlotte, So Fresh Saturdays: Baltimore Edition in Baltimore, Step Off Dance Off in Indianapolis or Fool's Gold Day Off LA in Los Angeles.",Fresh Empire,photo,https://www.facebook.com/FreshEmpire/photos/a.1059521187494357.1073741928.669417179838095/1059521327494343/?type=3,https://www.facebook.com/FreshEmpire/posts/1059638897482586,2016-09-29 22:01:56,846,0,0,795,47,3,1,0,0
669417179838095_1057937227652753,Ten toes down in the hustle means never losin' 10 years of life to an early death caused by cigs. What grind are you steppin' into?,Timeline Photos,photo,https://www.facebook.com/FreshEmpire/photos/a.725948810851598.1073741828.669417179838095/1057937227652753/?type=3,https://www.facebook.com/FreshEmpire/posts/1057937227652753:0,2016-09-27 20:30:01,1032,6,5,979,45,7,1,0,0
669417179838095_1056770954436047,,Fresh Empire,photo,https://www.facebook.com/FreshEmpire/photos/a.1056668784446264.1073741927.669417179838095/1056669434446199/?type=3,https://www.facebook.com/FreshEmpire/posts/1056770954436047,2016-09-26 13:09:56,763,1,0,747,16,0,0,0,0
669417179838095_1055957414517401,"🎤 CYPHER SUNDAY 🎤: ""That look in your eyes says all they need to know, either you seekin' dollar signs or you see the globe."" Drop your freshest rhyme below.",Timeline Photos,photo,https://www.facebook.com/FreshEmpire/photos/a.725948810851598.1073741828.669417179838095/1055957414517401/?type=3,https://www.facebook.com/FreshEmpire/posts/1055957414517401:0,2016-09-25 13:00:02,21,0,4,18,3,0,0,0,0
669417179838095_1055133641266445,Play it smart - don't lose 10 years of your future plans because of early death caused by cigs.,Timeline Photos,photo,https://www.facebook.com/FreshEmpire/photos/a.725948810851598.1073741828.669417179838095/1055133641266445/?type=3,https://www.facebook.com/FreshEmpire/posts/1055133641266445:0,2016-09-24 14:08:01,617,1,6,588,21,6,2,0,0
669417179838095_1053664911413318,Some people just have the total package. How do you stay on top your game? 💪 💪 💪,Timeline Photos,photo,https://www.facebook.com/FreshEmpire/photos/a.725948810851598.1073741828.669417179838095/1053664911413318/?type=3,https://www.facebook.com/FreshEmpire/posts/1053664911413318:0,2016-09-22 18:00:01,886,1,6,852,30,1,2,0,1
669417179838095_1053504494762693,"Hitmakin' producer WondaGurl is ready to put her cosign behind an up and coming rapper, artist, or beat boxer. Hit the link for details on how to enter 👉🏽 👉🏽 👉🏽   http://bit.ly/Cosign1.",Battle For The Co-Sign | WondaGurl,video,https://www.facebook.com/FreshEmpire/videos/1053504494762693/,https://www.facebook.com/FreshEmpire/videos/1053504494762693/,2016-09-22 13:30:23,143,6,17,138,5,0,0,0,0
669417179838095_1052819904831152,Sage The Gemini didn't hustle his whole life just to lose 10 years to an early death caused by cigs. What goals are you grindin' for?,Sage the Gemini's Come Up (Part 2),video,https://www.facebook.com/FreshEmpire/videos/1052819904831152/,https://www.facebook.com/FreshEmpire/videos/1052819904831152/,2016-09-21 17:30:39,66,1,5,64,2,0,0,0,0
669417179838095_1051134971666312,"Sage The Gemini is lookin' for a 🔥 rapper, singer or beat boxer to put his cosign behind. Enter here → http://bit.ly/Cosign1.",Timeline Photos,photo,https://www.facebook.com/FreshEmpire/photos/a.725948810851598.1073741828.669417179838095/1051134971666312/?type=3,https://www.facebook.com/FreshEmpire/posts/1051134971666312:0,2016-09-19 15:15:01,1192,13,14,1112,68,4,7,1,0
669417179838095_1050833415029801,Motivation Monday. 💯,Timeline Photos,photo,https://www.facebook.com/FreshEmpire/photos/a.725948810851598.1073741828.669417179838095/1050833415029801/?type=3,https://www.facebook.com/FreshEmpire/posts/1050833415029801:0,2016-09-19 07:00:02,840,4,7,812,26,2,0,0,0
