status_id,status_message,link_name,status_type,status_link,permalink_url,status_published,num_reactions,num_comments,num_shares,num_likes,num_loves,num_wows,num_hahas,num_sads,num_angrys
669417179838095_958968300882980,Doesn't matter where you come from. LIKE if success is your destiny. 💯💯💯,Timeline Photos,photo,https://www.facebook.com/FreshEmpire/photos/a.725948810851598.1073741828.669417179838095/958968300882980/?type=3,https://www.facebook.com/FreshEmpire/posts/958968300882980:0,2016-05-14 11:30:00,104,1,5,98,6,0,0,0,0
669417179838095_958966270883183,"SHARE if you're showing lil sis how to be tobacco-free and fresh, just like you. 👩🏽",Timeline Photos,photo,https://www.facebook.com/FreshEmpire/photos/a.725948810851598.1073741828.669417179838095/958966270883183/?type=3,https://www.facebook.com/FreshEmpire/posts/958966270883183:0,2016-05-13 14:30:00,229,3,2,229,0,0,0,0,0
669417179838095_958963767550100,If you're rockin' with Fresh Empire and staying tobacco-free...you're already out here winnin'. LIKE if that's you. 💯👌💯,Timeline Photos,photo,https://www.facebook.com/FreshEmpire/photos/a.725948810851598.1073741828.669417179838095/958963767550100/?type=3,https://www.facebook.com/FreshEmpire/posts/958963767550100:0,2016-05-12 11:30:00,115,0,8,115,0,0,0,0,0
669417179838095_958455564267587,"Who fell through Power 106 All Star Basketball Game - Alhambra in Los Angeles, Rolling Loud Festival in Miami, Kixfair in Atlanta, Solefest in Tampa, and Spring Bling Block Party in Charlotte, and kicked it with Fresh Empire? Check out the pics from May 3rd - 8th, and tag yourself and your squad!",Fresh Empire,photo,https://www.facebook.com/FreshEmpire/photos/a.958425260937284.1073741905.669417179838095/958425284270615/?type=3,https://www.facebook.com/FreshEmpire/posts/958455564267587,2016-05-10 14:41:03,681,16,0,678,3,0,0,0,0
669417179838095_957893244323819,Motivation Monday.,Timeline Photos,photo,https://www.facebook.com/FreshEmpire/photos/a.725948810851598.1073741828.669417179838095/957893244323819/?type=3,https://www.facebook.com/FreshEmpire/posts/957893244323819:0,2016-05-09 14:39:00,33,0,8,31,2,0,0,0,0
669417179838095_954236928022784,"Keep your family winnin' by staying tobacco-free, cause if you smoke, your lil sis is more likely to smoke, too. 💚 💚 💚",Timeline Photos,photo,https://www.facebook.com/FreshEmpire/photos/a.725948810851598.1073741828.669417179838095/954236928022784/?type=3,https://www.facebook.com/FreshEmpire/posts/954236928022784:0,2016-05-07 13:30:00,541,1,8,522,13,1,0,1,1
669417179838095_954236471356163,Name a pair of kicks that you definitely keep in the box. 👌,Timeline Photos,photo,https://www.facebook.com/FreshEmpire/photos/a.725948810851598.1073741828.669417179838095/954236471356163/?type=3,https://www.facebook.com/FreshEmpire/posts/954236471356163:0,2016-05-06 10:48:00,883,27,19,856,20,5,1,1,0
669417179838095_954232004689943,"If you think no one can freestyle like you on the dance floor--enter the ""Fresh Moves"" dance challenge and prove it. http://bit.ly/FreshMoves3",DO YOU HAVE FRESH MOVES?,link,http://bit.ly/FreshMoves3,https://www.facebook.com/FreshEmpire/posts/954232004689943,2016-05-04 17:36:00,269,6,7,266,2,0,0,0,0
669417179838095_954868381292972,"Who fell through 2Turnt Saturday in Chicago, So Turnt Saturday in Charlotte, or the Let's Dance Tour in DC, Philly, or NYC? We were also in ATL with the Les Twins and in DC at the Broccoli City Festival. If you came through and kicked it with Fresh Empire, April 26 – May 1, tag yourself and your squad!",Fresh Empire,photo,https://www.facebook.com/FreshEmpire/photos/a.954840421295768.1073741904.669417179838095/954840474629096/?type=3,https://www.facebook.com/FreshEmpire/posts/954868381292972,2016-05-04 14:03:10,826,2,1,801,12,0,0,0,0
669417179838095_954235048022972,"Real talk, lil sis is more likely to start smoking if you do. Protect your day 1 by living tobacco-free. 💚 💚 💚",Timeline Photos,photo,https://www.facebook.com/FreshEmpire/photos/a.725948810851598.1073741828.669417179838095/954235048022972/?type=3,https://www.facebook.com/FreshEmpire/posts/954235048022972:0,2016-05-03 16:45:00,404,1,4,403,1,0,0,0,0
669417179838095_951696304943513,LIKE if you never question where your lil sis gets her swag. 👑 👑 👑,Timeline Photos,photo,https://www.facebook.com/FreshEmpire/photos/a.725948810851598.1073741828.669417179838095/951696304943513/?type=3,https://www.facebook.com/FreshEmpire/posts/951696304943513:0,2016-05-01 15:30:00,10224,74,145,9855,242,6,121,0,0
669417179838095_952833971496413,,Fresh Empire's cover photo,photo,https://www.facebook.com/FreshEmpire/photos/a.711977672248712.1073741827.669417179838095/952833971496413/?type=3,https://www.facebook.com/FreshEmpire/posts/952833994829744,2016-05-01 08:50:52,34,1,2,34,0,0,0,0,0
669417179838095_927662277346916,How do you keep your fashion game on lock? COMMENT and let us know.,Timeline Photos,photo,https://www.facebook.com/FreshEmpire/photos/a.725948810851598.1073741828.669417179838095/927662277346916/?type=3,https://www.facebook.com/FreshEmpire/posts/927662277346916:0,2016-04-29 14:33:00,207,2,0,203,2,1,0,1,0
669417179838095_946162942163516,Kinjaz out here in the matrix. Get plugged into the dance challenge before it's too late. http://bit.ly/FreshMoves3,Timeline Photos,photo,https://www.facebook.com/FreshEmpire/photos/a.725948810851598.1073741828.669417179838095/946162942163516/?type=3,https://www.facebook.com/FreshEmpire/posts/946162942163516:0,2016-04-28 14:36:01,576,0,8,564,5,1,6,0,0
669417179838095_950644845048659,"Did you fall through the Fresh Empire booth this weekend? We were in ATL, LA, Philly, Birmingham, Charlotte, and Houston, April 21st - April 24th.",Fresh Empire,photo,https://www.facebook.com/FreshEmpire/photos/a.950636111716199.1073741903.669417179838095/950636128382864/?type=3,https://www.facebook.com/FreshEmpire/posts/950644845048659,2016-04-27 22:29:09,1702,4,0,1683,17,0,2,0,0
669417179838095_927861123993698,Shout out to all the big sisters showin' the way and living tobacco-free. TAG a big sister that always reps for the lil ones.,Lil Sis Stay Watchin,video,https://www.facebook.com/FreshEmpire/videos/927861123993698/,https://www.facebook.com/FreshEmpire/videos/927861123993698/,2016-04-27 18:44:00,555,18,44,523,28,4,0,0,0
669417179838095_931458363633974,"Ladies, hit the LIKE or ❤️ button if you're tobacco-free and fresh. 😏👌🏽👸🏽",Timeline Photos,photo,https://www.facebook.com/FreshEmpire/photos/a.725948810851598.1073741828.669417179838095/931458363633974/?type=3,https://www.facebook.com/FreshEmpire/posts/931458363633974:0,2016-04-26 19:33:00,116,3,0,110,6,0,0,0,0
669417179838095_927687894011021,MOTIVATION MONDAY: You've never been more prepared for success than you are right now. 👑👑👑,Timeline Photos,photo,https://www.facebook.com/FreshEmpire/photos/a.725948810851598.1073741828.669417179838095/927687894011021/?type=3,https://www.facebook.com/FreshEmpire/posts/927687894011021:0,2016-04-25 06:38:00,188,1,1,186,2,0,0,0,0
669417179838095_927659247347219,DANCERS- where ya'll at? If you had a shot to hit the floor with any artist who would you vibe with and why? 🎶🎶🎶,Timeline Photos,photo,https://www.facebook.com/FreshEmpire/photos/a.725948810851598.1073741828.669417179838095/927659247347219/?type=3,https://www.facebook.com/FreshEmpire/posts/927659247347219:0,2016-04-23 12:40:00,94,0,3,91,3,0,0,0,0
669417179838095_946159828830494,"Our first theme in the Fresh Moves dance challenge is SHAKE. It seems easy, but the Kinjaz put their own twist on it. Think you can handle it?",Vinh,video,https://www.facebook.com/FreshEmpire/videos/946159828830494/,https://www.facebook.com/FreshEmpire/videos/946159828830494/,2016-04-22 15:43:00,6267,84,614,5979,201,76,6,0,2
669417179838095_946090815504062,Enter the Fresh Moves dance challenge to see how your skills stack up against the competition.,Ben,video,https://www.facebook.com/FreshEmpire/videos/946090815504062/,https://www.facebook.com/FreshEmpire/videos/946090815504062/,2016-04-20 19:30:00,444,5,30,432,12,0,0,0,0
669417179838095_931457443634066,LONG LIVE FRESH EMPIRE. Keep it fresh. Live tobacco-free. Hit the ❤️ if you're feeling this video.,Long Live Fresh Empire,video,https://www.facebook.com/FreshEmpire/videos/931457443634066/,https://www.facebook.com/FreshEmpire/videos/931457443634066/,2016-04-20 17:50:00,523,14,34,462,56,1,3,0,1
669417179838095_945928102187000,Who fell through the Versa-Style in LA or Spring Live in Raleigh and kicked it with Fresh Empire? Check out the pics and tag yourself and your squad!,Fresh Empire,photo,https://www.facebook.com/FreshEmpire/photos/a.945923478854129.1073741902.669417179838095/945923542187456/?type=3,https://www.facebook.com/FreshEmpire/posts/945928102187000,2016-04-20 10:24:38,1153,3,0,1142,7,0,3,0,1
669417179838095_927644684015342,Are your younger bros always checkin' your style to see what's good? SHARE if you live tobacco-free for the love of your fam.,Timeline Photos,photo,https://www.facebook.com/FreshEmpire/photos/a.725948810851598.1073741828.669417179838095/927644684015342/?type=3,https://www.facebook.com/FreshEmpire/posts/927644684015342:0,2016-04-19 17:30:00,1727,16,46,1655,52,13,5,1,1
669417179838095_927644154015395,Three words to help yourself through any situation: I GOT THIS. What's your mantra? 💯💪💯,Timeline Photos,photo,https://www.facebook.com/FreshEmpire/photos/a.725948810851598.1073741828.669417179838095/927644154015395/?type=3,https://www.facebook.com/FreshEmpire/posts/927644154015395:0,2016-04-18 16:11:00,496,1,5,491,5,0,0,0,0
669417179838095_927643347348809,LIKE if you wake up just to get dressed and be fly! 💯💯💯,Timeline Photos,photo,https://www.facebook.com/FreshEmpire/photos/a.725948810851598.1073741828.669417179838095/927643347348809/?type=3,https://www.facebook.com/FreshEmpire/posts/927643347348809:0,2016-04-16 15:30:00,805,3,5,788,16,0,1,0,0
669417179838095_927640647349079,"FRFR, your lane is meant for you to make boss moves. What moves are you making right now? 👑💪👑",Timeline Photos,photo,https://www.facebook.com/FreshEmpire/photos/a.725948810851598.1073741828.669417179838095/927640647349079/?type=3,https://www.facebook.com/FreshEmpire/posts/927640647349079:0,2016-04-15 13:01:01,614,4,11,600,10,4,0,0,0
669417179838095_927662620680215,Rep for your squad and your family. Check out this vid.,Family Over Everything,video,https://www.facebook.com/FreshEmpire/videos/927662620680215/,https://www.facebook.com/FreshEmpire/videos/927662620680215/,2016-04-14 17:03:00,3597,40,286,3497,71,23,4,2,0
669417179838095_941343209312156,"Did you fall through the Fresh Empire booth this weekend? We were in ATL, Dallas, New Jersey and NYC.",Fresh Empire,photo,https://www.facebook.com/FreshEmpire/photos/a.941325549313922.1073741901.669417179838095/941325589313918/?type=3,https://www.facebook.com/FreshEmpire/posts/941343209312156,2016-04-12 21:11:33,1135,1,0,1121,14,0,0,0,0
669417179838095_927686754011135,MOTIVATION MONDAY: Dream. Plan. Live. 💯💯💯,Timeline Photos,photo,https://www.facebook.com/FreshEmpire/photos/a.725948810851598.1073741828.669417179838095/927686754011135/?type=3,https://www.facebook.com/FreshEmpire/posts/927686754011135:0,2016-04-11 07:33:00,391,4,8,385,6,0,0,0,0
669417179838095_927635024016308,Show some ❤ on National Sibling Day and TAG your true Day 1s! Let 'em know you live tobacco-free for the love of family.,Timeline Photos,photo,https://www.facebook.com/FreshEmpire/photos/a.725948810851598.1073741828.669417179838095/927635024016308/?type=3,https://www.facebook.com/FreshEmpire/posts/927635024016308:0,2016-04-10 18:54:00,3592,28,109,3469,108,2,11,1,0
669417179838095_931449556968188,Hit the LOVE button if you rep for all the strong ladies who stay focused on their grind. 💪💪💪,Timeline Photos,photo,https://www.facebook.com/FreshEmpire/photos/a.725948810851598.1073741828.669417179838095/931449556968188/?type=3,https://www.facebook.com/FreshEmpire/posts/931449556968188:0,2016-04-08 16:15:00,1111,2,26,1042,67,2,0,0,0
669417179838095_931447060301771,Hit LIKE or LOVE if you know that Hip Hop ain't dead. Check out this video to see why.,Beat Box Skills,video,https://www.facebook.com/FreshEmpire/videos/931447060301771/,https://www.facebook.com/FreshEmpire/videos/931447060301771/,2016-04-06 14:30:00,7645,158,626,7130,368,106,17,4,18
669417179838095_937408916372252,"Did you fall through the Fresh Empire booth this weekend? We were in ATL, Dallas, Houston, Phoenix, and LA.",Fresh Empire,photo,https://www.facebook.com/FreshEmpire/photos/a.937389273040883.1073741899.669417179838095/937389299707547/?type=3,https://www.facebook.com/FreshEmpire/posts/937408916372252,2016-04-06 08:58:48,1402,7,0,1391,9,0,2,0,0
669417179838095_927628690683608,LIKE if you're livin' tobacco-free cause you want the lil homies to be just as fresh as you.,Timeline Photos,photo,https://www.facebook.com/FreshEmpire/photos/a.725948810851598.1073741828.669417179838095/927628690683608/?type=3,https://www.facebook.com/FreshEmpire/posts/927628690683608:0,2016-04-05 15:50:00,1084,16,33,1052,26,2,4,0,0
669417179838095_927679574011853,"MOTIVATION MONDAY: Surround yourself with the movers and shakers, dreamers and believers.... and make sure you always dress like you're ready for a million dollar meeting. 💯💯💯",Timeline Photos,photo,https://www.facebook.com/FreshEmpire/photos/a.725948810851598.1073741828.669417179838095/927679574011853/?type=3,https://www.facebook.com/FreshEmpire/posts/927679574011853:0,2016-04-04 06:19:00,520,5,6,512,8,0,0,0,0
669417179838095_931445743635236,Sassy wedges or some stylish kicks…which shoe represents your style? COMMENT ↓↓↓.,Timeline Photos,photo,https://www.facebook.com/FreshEmpire/photos/a.725948810851598.1073741828.669417179838095/931445743635236/?type=3,https://www.facebook.com/FreshEmpire/posts/931445743635236:0,2016-04-02 11:07:00,1169,169,30,1107,40,6,12,1,3
669417179838095_927617584018052,Prom season is here! TAG a king that you wanna see up on that throne. 👑👑👑,Timeline Photos,photo,https://www.facebook.com/FreshEmpire/photos/a.725948810851598.1073741828.669417179838095/927617584018052/?type=3,https://www.facebook.com/FreshEmpire/posts/927617584018052:0,2016-04-01 14:20:00,830,13,11,807,17,5,1,0,0
669417179838095_934230373356773,,Fresh Empire's cover photo,photo,https://www.facebook.com/FreshEmpire/photos/a.711977672248712.1073741827.669417179838095/934230373356773/?type=3,https://www.facebook.com/FreshEmpire/posts/934230413356769,2016-04-01 10:19:27,25,0,1,25,0,0,0,0,0
669417179838095_910602312386246,"When lil bro is watching you, what are you gonna show him?",Just Like You,video,https://www.facebook.com/FreshEmpire/videos/910602312386246/,https://www.facebook.com/FreshEmpire/videos/910602312386246/,2016-03-30 20:30:00,9412,114,997,8964,263,161,21,2,1
669417179838095_931721506940993,Did you come kick it with us at the Power 106 All Star Basketball Series - Anaheim? Check out the pics and tag the squad.,Fresh Empire,photo,https://www.facebook.com/FreshEmpire/photos/a.931717066941437.1073741898.669417179838095/931717113608099/?type=3,https://www.facebook.com/FreshEmpire/posts/931721506940993,2016-03-29 20:48:53,1688,7,0,1675,9,3,1,0,0
669417179838095_908249805954830,"Lil sis is tryin' to stunt like you, so keep it tobacco free cause if you smoke, she's more likely to pick it up, too. Drop a comment about what she is copying from you.",Timeline Photos,photo,https://www.facebook.com/FreshEmpire/photos/a.725948810851598.1073741828.669417179838095/908249805954830/?type=3,https://www.facebook.com/FreshEmpire/posts/908249805954830:0,2016-03-29 18:15:00,839,7,7,822,14,0,3,0,0
669417179838095_908249269288217,Woke up on a Monday hungry to get what's yours! BEASTMODE. ⏰⏰⏰,Timeline Photos,photo,https://www.facebook.com/FreshEmpire/photos/a.725948810851598.1073741828.669417179838095/908249269288217/?type=3,https://www.facebook.com/FreshEmpire/posts/908249269288217:0,2016-03-28 05:20:00,746,0,7,733,8,2,2,1,0
669417179838095_908247605955050,Name your go to cut that got the ladies like 😍. GO!,Timeline Photos,photo,https://www.facebook.com/FreshEmpire/photos/a.725948810851598.1073741828.669417179838095/908247605955050/?type=3,https://www.facebook.com/FreshEmpire/posts/908247605955050:0,2016-03-26 20:15:00,1686,50,18,1670,14,0,2,0,0
669417179838095_908238929289251,We're always showin' 💚💚💚  to the Fresh Empire ladies cause they keep it tobacco-free. LIKE if that's you.,Timeline Photos,photo,https://www.facebook.com/FreshEmpire/photos/a.725948810851598.1073741828.669417179838095/908238929289251/?type=3,https://www.facebook.com/FreshEmpire/posts/908238929289251:0,2016-03-25 19:30:01,3278,16,55,3194,66,15,3,0,0
669417179838095_925233374256473,https://www.facebook.com/media/set/?set=a.925223577590786.1073741897.669417179838095&type=3,Fresh Empire,photo,https://www.facebook.com/FreshEmpire/photos/a.925223577590786.1073741897.669417179838095/925223597590784/?type=3,https://www.facebook.com/FreshEmpire/posts/925233374256473,2016-03-22 21:12:49,1074,5,0,1063,7,1,0,0,3
669417179838095_908193722627105,Confidence is key in this game. What drives your confidence? Drop a comment. 💯💯💯,Timeline Photos,photo,https://www.facebook.com/FreshEmpire/photos/a.725948810851598.1073741828.669417179838095/908193722627105/?type=3,https://www.facebook.com/FreshEmpire/posts/908193722627105:0,2016-03-22 20:10:00,314,5,6,306,7,1,0,0,0
669417179838095_925114654268345,Did you come kick it with us at the Let's Dance Tour in Chicago? Check out the pics and tag the squad.,Let's Dance Tour Chicago,photo,https://www.facebook.com/FreshEmpire/photos/a.925114630935014.1073741896.669417179838095/925114654268345/?type=3,https://www.facebook.com/FreshEmpire/posts/925114654268345,2016-03-22 18:20:12,29,3,1,29,0,0,0,0,0
669417179838095_908236532622824,"Motivation Monday: If you're a dancer, dance. If you're a writer, write. If you're an artist, create. There's no time like NOW to perfect your craft. How many hours a day are you puttin' in? 🕜🕜🕜",Timeline Photos,photo,https://www.facebook.com/FreshEmpire/photos/a.725948810851598.1073741828.669417179838095/908236532622824/?type=3,https://www.facebook.com/FreshEmpire/posts/908236532622824:0,2016-03-21 06:00:00,206,4,9,201,5,0,0,0,0
669417179838095_908234985956312,"Lil bro is mad young, but already has a vision because of you. Make sure that includes staying fresh and tobacco-free. 😎",Timeline Photos,photo,https://www.facebook.com/FreshEmpire/photos/a.725948810851598.1073741828.669417179838095/908234985956312/?type=3,https://www.facebook.com/FreshEmpire/posts/908234985956312:0,2016-03-20 21:00:00,739,4,7,728,10,0,0,0,1
669417179838095_908233665956444,"Whether it's hittin' moves in a dance battle or in life, keep it tobacco-free for the love of your lil bro.",Timeline Photos,photo,https://www.facebook.com/FreshEmpire/photos/a.725948810851598.1073741828.669417179838095/908233665956444/?type=3,https://www.facebook.com/FreshEmpire/posts/908233665956444:0,2016-03-18 19:00:00,261,0,4,256,3,0,1,1,0
669417179838095_908241425955668,New. Now. Next. SHARE if you're a legend in the making.,New. Now. Next.,video,https://www.facebook.com/FreshEmpire/videos/908241425955668/,https://www.facebook.com/FreshEmpire/videos/908241425955668/,2016-03-16 18:20:00,866,12,82,847,11,1,2,3,2
669417179838095_920060598107084,Did you and the squad fall through Spring Bling Teen Night? Check out the pics and tag your squad.,Spring Bling Teen Night,photo,https://www.facebook.com/FreshEmpire/photos/a.920060561440421.1073741895.669417179838095/920060598107084/?type=3,https://www.facebook.com/FreshEmpire/posts/920060598107084,2016-03-15 22:53:43,11,0,0,11,0,0,0,0,0
669417179838095_908258972620580,"Keep that bond crazy tight by living tobacco-free, cause if you smoke, she's more likely to smoke too. SHARE if nothing gets between you and your lil sis. 💚💪🏽💚",Timeline Photos,photo,https://www.facebook.com/FreshEmpire/photos/a.725948810851598.1073741828.669417179838095/908258972620580/?type=3,https://www.facebook.com/FreshEmpire/posts/908258972620580:0,2016-03-15 19:05:00,929,7,33,907,22,0,0,0,0
669417179838095_908220952624382,"Grind it out for yourself, your fam, your squad, and your block. S/O your city below.",Timeline Photos,photo,https://www.facebook.com/FreshEmpire/photos/a.725948810851598.1073741828.669417179838095/908220952624382/?type=3,https://www.facebook.com/FreshEmpire/posts/908220952624382:0,2016-03-14 20:45:00,479,2,10,471,7,1,0,0,0
669417179838095_919287808184363,Did you and the squad fall through Quake Awake? Check out the pics and tag your squad.,Quake Awake,photo,https://www.facebook.com/FreshEmpire/photos/a.919287404851070.1073741892.669417179838095/919287808184363/?type=3,https://www.facebook.com/FreshEmpire/posts/919287808184363,2016-03-14 20:35:12,10,0,1,9,1,0,0,0,0
669417179838095_908200189293125,Females have made a huge mark in Hip Hop over the past decade. Who's the most notable Hip Hop female of all time? 👸🏽👸🏽👸🏽,Timeline Photos,photo,https://www.facebook.com/FreshEmpire/photos/a.725948810851598.1073741828.669417179838095/908200189293125/?type=3,https://www.facebook.com/FreshEmpire/posts/908200189293125:0,2016-03-13 20:45:00,491,12,3,486,4,0,1,0,0
669417179838095_908197722626705,"Lights, camera, action. 🎥  Your part? Keeping lil bro tobacco-free for the love of family. 💚",Timeline Photos,photo,https://www.facebook.com/FreshEmpire/photos/a.725948810851598.1073741828.669417179838095/908197722626705/?type=3,https://www.facebook.com/FreshEmpire/posts/908197722626705:0,2016-03-11 20:00:00,1446,5,12,1409,37,0,0,0,0
669417179838095_908773495902461,"As the oldest ones in the fam, we stay lookin' out for all the young ones. Check out our vid to see how ""We Watch Out"" by keeping it tobacco-free.",We Watch Out,video,https://www.facebook.com/FreshEmpire/videos/908773495902461/,https://www.facebook.com/FreshEmpire/videos/908773495902461/,2016-03-09 20:40:00,646,4,65,633,13,0,0,0,0
669417179838095_915373875242423,Did you fall through the Fresh Empire booth at Wild 94.1's Wild Splash? Check out the pics and tag your squad.,Wild 94.1's Wild Splash,photo,https://www.facebook.com/FreshEmpire/photos/a.915373848575759.1073741889.669417179838095/915373875242423/?type=3,https://www.facebook.com/FreshEmpire/posts/915373875242423,2016-03-08 20:33:43,9,0,0,9,0,0,0,0,0
669417179838095_908196709293473,Calling ALL dreamers-- your empire is waiting. SHARE if you're ready.,Timeline Photos,photo,https://www.facebook.com/FreshEmpire/photos/a.725948810851598.1073741828.669417179838095/908196709293473/?type=3,https://www.facebook.com/FreshEmpire/posts/908196709293473:0,2016-03-08 19:30:00,533,1,11,526,4,2,1,0,0
669417179838095_915291288584015,Did you fall through the Fresh Empire booth at the Let's Dance Tour in Atlanta? Check out the pics and tag your squad.,Let's Dance Tour - Atlanta,photo,https://www.facebook.com/FreshEmpire/photos/a.915291075250703.1073741887.669417179838095/915291288584015/?type=3,https://www.facebook.com/FreshEmpire/posts/915291288584015,2016-03-08 16:54:38,7,0,0,7,0,0,0,0,0
669417179838095_908195782626899,Come up as soon as the ☀️  up. What time do you usually start grindin?,Timeline Photos,photo,https://www.facebook.com/FreshEmpire/photos/a.725948810851598.1073741828.669417179838095/908195782626899/?type=3,https://www.facebook.com/FreshEmpire/posts/908195782626899:0,2016-03-07 06:30:00,2396,14,28,2369,14,9,2,1,1
669417179838095_908194572627020,"LIKE if your lil bros not only get their game from you, but will also live tobacco-free just like you. 💯💯💯",Timeline Photos,photo,https://www.facebook.com/FreshEmpire/photos/a.725948810851598.1073741828.669417179838095/908194572627020/?type=3,https://www.facebook.com/FreshEmpire/posts/908194572627020:0,2016-03-05 21:30:00,112,0,6,112,0,0,0,0,0
669417179838095_912954098817734,Did you and the squad fall through Power 106 All Star Basketball Series- Franklin? Check out the pics and tag your squad.,Fresh Empire,photo,https://www.facebook.com/FreshEmpire/photos/a.912947212151756.1073741886.669417179838095/912947255485085/?type=3,https://www.facebook.com/FreshEmpire/posts/912954098817734,2016-03-04 20:04:52,11,0,0,11,0,0,0,0,0
669417179838095_908780345901776,Is lil bro always buggin' cause he wants to be just like you? Check our new vid to see how you can help keep him on point by living tobacco-free.,Lil Brother,video,https://www.facebook.com/FreshEmpire/videos/908780345901776/,https://www.facebook.com/FreshEmpire/videos/908780345901776/,2016-03-03 20:50:00,20452,248,2490,19689,611,31,111,7,3
669417179838095_908170465962764,DJing is one of the 5 elements of Hip Hop. TAG your fav DJ and show some love. 👊👊👊,Timeline Photos,photo,https://www.facebook.com/FreshEmpire/photos/a.725948810851598.1073741828.669417179838095/908170465962764/?type=3,https://www.facebook.com/FreshEmpire/posts/908170465962764:0,2016-03-02 19:15:00,2462,46,9,2414,36,4,7,0,1
669417179838095_911583608954783,Did you fall through the Fresh Empire booth at Footwerk. Check out the pics and tag your squad.,Footwerk,photo,https://www.facebook.com/FreshEmpire/photos/a.911583475621463.1073741885.669417179838095/911583608954783/?type=3,https://www.facebook.com/FreshEmpire/posts/911583608954783,2016-03-02 09:58:41,9,1,0,9,0,0,0,0,0
669417179838095_908173159295828,Who is the freshest on the block? SHARE if that's you and your fam. 💯💯💯,Timeline Photos,photo,https://www.facebook.com/FreshEmpire/photos/a.725948810851598.1073741828.669417179838095/908173159295828/?type=3,https://www.facebook.com/FreshEmpire/posts/908173159295828:0,2016-03-01 21:09:00,324,2,12,313,11,0,0,0,0
